{
  "$schema": "https://json-schema.org/draft/2020-12/schema",
  "title": "RunDocument",
  "description": "cardiacFoam Run document v2. Version 2 is the canonical agent-authored planning contract; version 1 documents must be migrated explicitly before emission.",
  "type": "object",
  "required": ["version", "id", "name", "status", "config"],
  "properties": {
    "version": {"const": "2"},
    "id": {"type": "string", "minLength": 1},
    "name": {"type": "string", "minLength": 1},
    "createdAt": {"type": "string", "format": "date-time"},
    "lastModified": {"type": "string", "format": "date-time"},
    "status": {
      "enum": ["draft", "queued", "planning", "planned", "running", "completed", "failed"]
    },
    "intent": {
      "type": "object",
      "description": "Agent- or user-authored objective, constraints, and notes for this run.",
      "additionalProperties": true
    },
    "config": {
      "type": "object",
      "required": ["anatomy", "physics", "stimulus", "solver"],
      "properties": {
        "anatomy": {"type": "object"},
        "physics": {"$ref": "#/$defs/physicsSlice"},
        "stimulus": {"type": "object"},
        "solver": {"type": "object"}
      },
      "additionalProperties": false
    },
    "resolvedEntry": {
      "type": ["object", "null"],
      "properties": {
        "entry": {"type": "string"},
        "entryKind": {"type": ["string", "null"]},
        "entryPath": {"type": ["string", "null"]},
        "resolvedName": {"type": ["string", "null"]},
        "sourceType": {"type": ["string", "null"]},
        "workflowFamily": {"type": ["string", "null"]},
        "isRunnable": {"type": "boolean"}
      },
      "additionalProperties": true
    },
    "workflowDag": {
      "type": ["object", "null"],
      "description": "Descriptive workflow DAG. Execution/checkpointing is handled by a later milestone.",
      "required": ["schema_version", "step_status_values", "steps"],
      "properties": {
        "schema_version": {"const": "1"},
        "step_status_values": {
          "type": "array",
          "items": {
            "enum": ["pending", "running", "completed", "failed", "skipped"]
          },
          "minItems": 5
        },
        "steps": {
          "type": "array",
          "items": {
            "type": "object",
            "required": [
              "id",
              "command",
              "args",
              "cwd",
              "depends_on",
              "produces",
              "consumes",
              "retry_policy",
              "command_display"
            ],
            "properties": {
              "id": {"type": "string", "minLength": 1},
              "command": {
                "type": "string",
                "minLength": 1,
                "description": "Executable name only; arguments live in args."
              },
              "args": {
                "type": "array",
                "items": {"type": "string"}
              },
              "cwd": {
                "type": "string",
                "minLength": 1,
                "description": "Case-relative working directory for the step."
              },
              "depends_on": {
                "type": "array",
                "items": {"type": "string"}
              },
              "produces": {
                "type": "array",
                "items": {"type": "string"}
              },
              "consumes": {
                "type": "array",
                "items": {"type": "string"}
              },
              "timeout_s": {
                "type": "integer",
                "minimum": 1
              },
              "retry_policy": {
                "type": "object",
                "properties": {
                  "max_attempts": {"type": "integer", "minimum": 1}
                },
                "additionalProperties": true
              },
              "command_display": {
                "type": "string",
                "minLength": 1
              }
            },
            "additionalProperties": true
          }
        }
      },
      "additionalProperties": true
    },
    "workflowState": {
      "type": ["object", "null"],
      "description": "Initial or runtime step-state snapshot derived from workflowDag.",
      "required": ["status", "current_step_id", "completed_steps", "failed_step_id", "steps"],
      "properties": {
        "status": {"$ref": "#/$defs/workflowStepStatus"},
        "current_step_id": {"type": ["string", "null"]},
        "completed_steps": {
          "type": "array",
          "items": {"type": "string"}
        },
        "failed_step_id": {"type": ["string", "null"]},
        "steps": {
          "type": "array",
          "items": {
            "type": "object",
            "required": [
              "step_id",
              "status",
              "attempt",
              "command",
              "args",
              "cwd",
              "started_at",
              "finished_at",
              "exit_code",
              "stdout_log",
              "stderr_log",
              "produced_artifacts",
              "diagnostics"
            ],
            "properties": {
              "step_id": {"type": "string", "minLength": 1},
              "status": {"$ref": "#/$defs/workflowStepStatus"},
              "attempt": {"type": "integer", "minimum": 0},
              "command": {"type": "string", "minLength": 1},
              "args": {
                "type": "array",
                "items": {"type": "string"}
              },
              "cwd": {"type": "string", "minLength": 1},
              "started_at": {"type": ["string", "null"], "format": "date-time"},
              "finished_at": {"type": ["string", "null"], "format": "date-time"},
              "exit_code": {"type": ["integer", "null"]},
              "stdout_log": {"type": ["string", "null"]},
              "stderr_log": {"type": ["string", "null"]},
              "produced_artifacts": {
                "type": "array",
                "items": {"type": "string"}
              },
              "diagnostics": {
                "type": "array",
                "items": {"$ref": "#/$defs/diagnostic"}
              }
            },
            "additionalProperties": false
          }
        }
      },
      "additionalProperties": false
    },
    "launch": {
      "type": ["object", "null"],
      "properties": {
        "action": {"type": "string"},
        "command": {
          "type": "array",
          "items": {"type": "string"}
        },
        "commandDisplay": {"type": "string"},
        "manifestPath": {"type": ["string", "null"]},
        "caseRoot": {"type": ["string", "null"]},
        "setupRoot": {"type": ["string", "null"]},
        "outputDir": {"type": ["string", "null"]}
      },
      "additionalProperties": true
    },
    "expectedArtifacts": {
      "type": "array",
      "items": {"$ref": "#/$defs/dataArtifact"}
    },
    "validation": {
      "type": "object",
      "properties": {
        "status": {"enum": ["ok", "failed", "not_run"]},
        "diagnostics": {
          "type": "array",
          "items": {"$ref": "#/$defs/diagnostic"}
        }
      },
      "additionalProperties": true
    },
    "results": {"type": ["object", "null"]},
    "reports": {
      "type": "object",
      "required": ["items"],
      "properties": {
        "items": {
          "type": "array",
          "items": {
            "type": "object",
            "required": ["id", "title", "url", "status"],
            "properties": {
              "id": {"type": "string"},
              "title": {"type": "string"},
              "url": {"type": "string"},
              "status": {"enum": ["ready", "generating", "failed"]},
              "generatedAt": {"type": "string", "format": "date-time"}
            },
            "additionalProperties": false
          }
        },
        "generatedAt": {"type": "string", "format": "date-time"}
      },
      "additionalProperties": false
    },
    "terminalStatusValues": {
      "type": "array",
      "items": {"type": "string"},
      "default": ["completed", "failed"]
    }
  },
  "additionalProperties": false,
  "$defs": {
    "workflowStepStatus": {
      "enum": ["pending", "running", "completed", "failed", "skipped"]
    },
    "diagnostic": {
      "type": "object",
      "required": ["level", "message"],
      "properties": {
        "level": {"enum": ["error", "warning", "info"]},
        "code": {"type": "string"},
        "field": {"type": "string"},
        "message": {"type": "string"},
        "source": {"type": "string"}
      },
      "additionalProperties": true
    },
    "dataArtifact": {
      "type": "object",
      "required": ["artifact_id", "path_pattern", "format"],
      "properties": {
        "artifact_id": {"type": "string"},
        "path_pattern": {"type": "string"},
        "format": {"type": "string"},
        "variables": {
          "type": "array",
          "items": {"type": "string"}
        },
        "description": {"type": "string"},
        "produced_by": {"type": "string"},
        "optional": {"type": "boolean"},
        "time_indexed": {"type": "boolean"}
      },
      "additionalProperties": false
    },
    "physicsSlice": {
      "type": "object",
      "description": "Physics-phase configuration as flat slot-keys. The complete authoritative key catalogue is openfoam_driver.dict_entries.",
      "properties": {
        "myocardiumSolver": {
          "type": "string",
          "description": "Top-level myocardium solver selector."
        },
        "ionicModel": {
          "type": "string",
          "description": "Ionic cell model selector."
        },
        "tissue": {
          "type": "string",
          "enum": ["epicardialCells", "mCells", "endocardialCells", "myocyte"]
        },
        "ionicHeterogeneity.field": {"type": "string"},
        "ionicHeterogeneity.mode": {
          "type": "string",
          "enum": ["transmuralBands"]
        },
        "ionicHeterogeneity.endoMInterface": {"type": ["string", "number"]},
        "ionicHeterogeneity.mEpiInterface": {"type": ["string", "number"]},
        "ionicHeterogeneity.transitionWidth": {"type": ["string", "number"]},
        "ionicHeterogeneity.transitionMode": {
          "type": "string",
          "enum": ["blend", "hard"]
        },
        "ionicHeterogeneity.smoothing": {
          "type": "string",
          "enum": ["smoothstep"]
        }
      },
      "additionalProperties": true
    }
  }
}
