{
  "id": "plan-singleCell",
  "name": "singleCell",
  "status": "planned",
  "config": {
    "anatomy": {},
    "physics": {
      "type": "electroModel",
      "myocardiumSolver": "singleCellSolver",
      "ionicModel": "TWorld",
      "tissue": "endocardialCells",
      "chi": "140000",
      "cm": "0.01"
    },
    "stimulus": {
      "externalStimulus.stimulusDuration": "0.002",
      "externalStimulus.stimulusIntensity": "50000",
      "singleCellStimulus.stim_start": "20",
      "singleCellStimulus.stim_period_S1": "1000",
      "singleCellStimulus.stim_duration": "1",
      "singleCellStimulus.stim_amplitude": "60",
      "singleCellStimulus.nstim1": "2",
      "singleCellStimulus.stim_period_S2": "0",
      "singleCellStimulus.nstim2": "0"
    },
    "solver": {
      "writeAfterTime": "0",
      "outputVariables.ionic.export": "(Vm cai nai ki AV_INa_INa AV_ICaL_ICaL AV_Ito_Ito AV_IKr_IKr AV_IKs_IKs AV_IK1_IK1 AV_INaCa_INaCa AV_INaK_INaK)",
      "outputVariables.ionic.debug": "(Vm)",
      "outputVariables.activeTension.export": "(AV_Ta)",
      "solver": "RKF45",
      "initialODEStep": "1e-5",
      "maxSteps": "1000000000",
      "absTol": "1e-6",
      "relTol": "1e-4"
    }
  },
  "version": "2",
  "createdAt": "",
  "lastModified": "",
  "intent": {
    "source": "strict_plan"
  },
  "resolvedEntry": {
    "entry": "singleCell",
    "entryKind": "registered_tutorial",
    "entryPath": "electrophysiologyProtocols/singleCell",
    "resolvedName": "singleCell",
    "sourceType": "spec_factory",
    "workflowFamily": null,
    "isRunnable": true
  },
  "workflowDag": {
    "schema_version": "1",
    "step_status_values": [
      "pending",
      "running",
      "completed",
      "failed",
      "skipped"
    ],
    "steps": [
      {
        "id": "solve",
        "command": "cardiacFoam",
        "args": [],
        "cwd": ".",
        "depends_on": [],
        "produces": [
          "single_cell_trace",
          "single_cell_vm_series"
        ],
        "consumes": [],
        "retry_policy": {},
        "command_display": "cardiacFoam"
      }
    ]
  },
  "workflowState": {
    "status": "pending",
    "current_step_id": "solve",
    "completed_steps": [],
    "failed_step_id": null,
    "steps": [
      {
        "step_id": "solve",
        "status": "pending",
        "attempt": 0,
        "command": "cardiacFoam",
        "args": [],
        "cwd": ".",
        "started_at": null,
        "finished_at": null,
        "exit_code": null,
        "stdout_log": null,
        "stderr_log": null,
        "produced_artifacts": [],
        "diagnostics": []
      }
    ]
  },
  "launch": {
    "action": "sim",
    "command": [
      "/opt/homebrew/opt/python@3.14/bin/python3.14",
      "-m",
      "openfoam_driver",
      "sim",
      "--entry",
      "singleCell"
    ],
    "commandDisplay": "/opt/homebrew/opt/python@3.14/bin/python3.14 -m openfoam_driver sim --entry singleCell",
    "manifestPath": "/Users/simaocastro/noFrontendCardiacFoam_minor_errors/tutorials/electrophysiologyProtocols/singleCell/postProcessing/run_manifest.json",
    "caseRoot": "/Users/simaocastro/noFrontendCardiacFoam_minor_errors/tutorials/electrophysiologyProtocols/singleCell",
    "setupRoot": "/Users/simaocastro/noFrontendCardiacFoam_minor_errors/tutorials/electrophysiologyProtocols/singleCell/setup",
    "outputDir": "/Users/simaocastro/noFrontendCardiacFoam_minor_errors/tutorials/electrophysiologyProtocols/singleCell/postProcessing"
  },
  "expectedArtifacts": [
    {
      "artifact_id": "single_cell_trace",
      "path_pattern": "postProcessing/*.txt",
      "format": "csv_sweep",
      "variables": [
        "Vm",
        "cai",
        "nai",
        "ki",
        "AV_INa_INa",
        "AV_ICaL_ICaL",
        "AV_Ito_Ito",
        "AV_IKr_IKr",
        "AV_IKs_IKs",
        "AV_IK1_IK1",
        "AV_INaCa_INaCa",
        "AV_INaK_INaK"
      ],
      "description": "Per-case time series produced by singleCellSolver (ionicModel=TWorld)",
      "produced_by": "singleCellSolver",
      "optional": false,
      "time_indexed": false
    },
    {
      "artifact_id": "single_cell_vm_series",
      "path_pattern": "{time}/Vm",
      "format": "openfoam_time_dirs",
      "variables": [
        "Vm"
      ],
      "description": "Membrane voltage Vm on 1-cell mesh (singleCellSolver, ionicModel=TWorld)",
      "produced_by": "singleCellSolver",
      "optional": true,
      "time_indexed": true
    }
  ],
  "validation": {
    "status": "ok",
    "diagnostics": []
  },
  "results": null,
  "terminalStatusValues": [
    "completed",
    "failed"
  ]
}