{
  "id": "plan-manufacturedFDABidomain",
  "name": "manufacturedFDABidomain",
  "status": "planned",
  "config": {
    "anatomy": {},
    "physics": {
      "type": "electroModel",
      "myocardiumSolver": "bidomainSolver",
      "ionicModel": "bidomainFDAManufactured",
      "dimension": "\"3D\"",
      "chi": "[0 -1 0 0 0 0 0] 3",
      "cm": "[-1 -4 4 0 0 2 0] 2",
      "conductivityIntracellular": "[-1 -3 3 0 0 2 0] (0.111453302 0 0 0.121585420 0 0.030396355)",
      "conductivityExtracellular": "[-1 -3 3 0 0 2 0] (0.046165469 0 0 0.050362330 0 0.012590582)",
      "phiERefPoint": "(0.125 0.05 0.05)",
      "phiEReferenceValue": "0.0"
    },
    "stimulus": {
      "externalStimulus.stimulusLocationMin": "(0 0 5.5e-3)",
      "externalStimulus.stimulusLocationMax": "(1.5e-3 1.5e-3 7e-3)",
      "externalStimulus.stimulusStartTime": "0",
      "externalStimulus.stimulusDuration": "[0 0 1 0 0 0 0] 0",
      "externalStimulus.stimulusIntensity": "[0 -3 0 0 0 1 0] 0",
      "stimulusLocationMin": "(0 0 5.5e-3)",
      "stimulusLocationMax": "(1.5e-3 1.5e-3 7e-3)"
    },
    "solver": {
      "solutionAlgorithm": "implicit",
      "activationThreshold": "0.0",
      "outputVariables.ionic.export": "(u1 u2 u3)",
      "outputVariables.ionic.debug": "(V u1 u2 u3 Iion)",
      "verificationModel.type": "manufacturedFDABidomainVerifier",
      "solver": "RKF45",
      "initialODEStep": "1e-5",
      "maxSteps": "1000000000"
    }
  },
  "version": "2",
  "createdAt": "",
  "lastModified": "",
  "intent": {
    "source": "strict_plan"
  },
  "resolvedEntry": {
    "entry": "manufacturedFDABidomain",
    "entryKind": "registered_tutorial",
    "entryPath": "manufacturedSolutions/bidomain",
    "resolvedName": "manufacturedFDABidomain",
    "sourceType": "spec_factory",
    "workflowFamily": null,
    "isRunnable": true
  },
  "workflowDag": {
    "schema_version": "1",
    "step_status_values": [
      "pending",
      "running",
      "completed",
      "failed",
      "skipped"
    ],
    "steps": [
      {
        "id": "mesh",
        "command": "blockMesh",
        "args": [],
        "cwd": ".",
        "depends_on": [],
        "produces": [],
        "consumes": [],
        "retry_policy": {},
        "command_display": "blockMesh"
      },
      {
        "id": "solve",
        "command": "cardiacFoam",
        "args": [],
        "cwd": ".",
        "depends_on": [
          "mesh"
        ],
        "produces": [
          "bidomain_vm_series",
          "bidomain_phie_series",
          "bidomain_phii_series",
          "bidomain_u1_series",
          "bidomain_u2_series",
          "bidomain_u3_series",
          "verification_error_summary"
        ],
        "consumes": [],
        "retry_policy": {},
        "command_display": "cardiacFoam"
      }
    ]
  },
  "workflowState": {
    "status": "pending",
    "current_step_id": "mesh",
    "completed_steps": [],
    "failed_step_id": null,
    "steps": [
      {
        "step_id": "mesh",
        "status": "pending",
        "attempt": 0,
        "command": "blockMesh",
        "args": [],
        "cwd": ".",
        "started_at": null,
        "finished_at": null,
        "exit_code": null,
        "stdout_log": null,
        "stderr_log": null,
        "produced_artifacts": [],
        "diagnostics": []
      },
      {
        "step_id": "solve",
        "status": "pending",
        "attempt": 0,
        "command": "cardiacFoam",
        "args": [],
        "cwd": ".",
        "started_at": null,
        "finished_at": null,
        "exit_code": null,
        "stdout_log": null,
        "stderr_log": null,
        "produced_artifacts": [],
        "diagnostics": []
      }
    ]
  },
  "launch": {
    "action": "sim",
    "command": [
      "/opt/homebrew/opt/python@3.14/bin/python3.14",
      "-m",
      "openfoam_driver",
      "sim",
      "--entry",
      "manufacturedFDABidomain"
    ],
    "commandDisplay": "/opt/homebrew/opt/python@3.14/bin/python3.14 -m openfoam_driver sim --entry manufacturedFDABidomain",
    "manifestPath": "/Users/simaocastro/noFrontendCardiacFoam_minor_errors/tutorials/manufacturedSolutions/bidomain/postProcessing/run_manifest.json",
    "caseRoot": "/Users/simaocastro/noFrontendCardiacFoam_minor_errors/tutorials/manufacturedSolutions/bidomain",
    "setupRoot": "/Users/simaocastro/noFrontendCardiacFoam_minor_errors/tutorials/manufacturedSolutions/bidomain/setup",
    "outputDir": "/Users/simaocastro/noFrontendCardiacFoam_minor_errors/tutorials/manufacturedSolutions/bidomain/postProcessing"
  },
  "expectedArtifacts": [
    {
      "artifact_id": "bidomain_vm_series",
      "path_pattern": "{time}/Vm",
      "format": "openfoam_time_dirs",
      "variables": [
        "Vm"
      ],
      "description": "Membrane voltage Vm (bidomainSolver, ionicModel=bidomainFDAManufactured)",
      "produced_by": "bidomainSolver",
      "optional": false,
      "time_indexed": true
    },
    {
      "artifact_id": "bidomain_phie_series",
      "path_pattern": "{time}/phiE",
      "format": "openfoam_time_dirs",
      "variables": [
        "phiE"
      ],
      "description": "Extracellular potential phiE (bidomainSolver)",
      "produced_by": "bidomainSolver",
      "optional": false,
      "time_indexed": true
    },
    {
      "artifact_id": "bidomain_phii_series",
      "path_pattern": "{time}/phiI",
      "format": "openfoam_time_dirs",
      "variables": [
        "phiI"
      ],
      "description": "Intracellular potential phiI (bidomainSolver)",
      "produced_by": "bidomainSolver",
      "optional": false,
      "time_indexed": true
    },
    {
      "artifact_id": "bidomain_u1_series",
      "path_pattern": "{time}/u1",
      "format": "openfoam_time_dirs",
      "variables": [
        "u1"
      ],
      "description": "Ionic export u1 (bidomainSolver)",
      "produced_by": "bidomainSolver",
      "optional": false,
      "time_indexed": true
    },
    {
      "artifact_id": "bidomain_u2_series",
      "path_pattern": "{time}/u2",
      "format": "openfoam_time_dirs",
      "variables": [
        "u2"
      ],
      "description": "Ionic export u2 (bidomainSolver)",
      "produced_by": "bidomainSolver",
      "optional": false,
      "time_indexed": true
    },
    {
      "artifact_id": "bidomain_u3_series",
      "path_pattern": "{time}/u3",
      "format": "openfoam_time_dirs",
      "variables": [
        "u3"
      ],
      "description": "Ionic export u3 (bidomainSolver)",
      "produced_by": "bidomainSolver",
      "optional": false,
      "time_indexed": true
    },
    {
      "artifact_id": "verification_error_summary",
      "path_pattern": "postProcessing/*_*_cells_*.dat",
      "format": "csv_probe",
      "variables": [],
      "description": "Manufactured-solution L1/L2/Linf error norms emitted by manufacturedFDABidomainVerifier",
      "produced_by": "manufacturedFDABidomainVerifier",
      "optional": false,
      "time_indexed": false
    }
  ],
  "validation": {
    "status": "ok",
    "diagnostics": []
  },
  "results": null,
  "terminalStatusValues": [
    "completed",
    "failed"
  ]
}