{
  "id": "plan-manufacturedFDA",
  "name": "manufacturedFDA",
  "status": "planned",
  "config": {
    "anatomy": {},
    "physics": {
      "type": "electroModel",
      "myocardiumSolver": "monodomainSolver",
      "ionicModel": "monodomainFDAManufactured",
      "dimension": "\"3D\"",
      "conductivity": "[-1 -3 3 0 0 2 0] (0.111453302 0 0 0.121585420 0 0.030396355)",
      "chi": "[0 -1 0 0 0 0 0] 3",
      "cm": "[-1 -4 4 0 0 2 0] 2"
    },
    "stimulus": {
      "externalStimulus.stimulusLocationMin": "(0 0 5.5e-3)",
      "externalStimulus.stimulusLocationMax": "(1.5e-3 1.5e-3 7e-3)",
      "externalStimulus.stimulusStartTime": "0",
      "externalStimulus.stimulusDuration": "[0 0 1 0 0 0 0] 0",
      "externalStimulus.stimulusIntensity": "[0 -3 0 0 0 1 0] 0",
      "stimulusLocationMin": "(0 0 5.5e-3)",
      "stimulusLocationMax": "(1.5e-3 1.5e-3 7e-3)"
    },
    "solver": {
      "solutionAlgorithm": "implicit",
      "activationThreshold": "0.0",
      "outputVariables.ionic.export": "(u1 u2 u3)",
      "outputVariables.ionic.debug": "(V u1 u2 u3 Iion)",
      "verificationModel.type": "manufacturedFDAMonodomainVerifier",
      "solver": "RKF45",
      "initialODEStep": "1e-5",
      "maxSteps": "1000000000"
    }
  },
  "version": "2",
  "createdAt": "",
  "lastModified": "",
  "intent": {
    "source": "strict_plan"
  },
  "resolvedEntry": {
    "entry": "manufacturedFDA",
    "entryKind": "registered_tutorial",
    "entryPath": "manufacturedSolutions/monodomainPseudoECG",
    "resolvedName": "manufacturedFDA",
    "sourceType": "spec_factory",
    "workflowFamily": null,
    "isRunnable": true
  },
  "workflowDag": {
    "schema_version": "1",
    "step_status_values": [
      "pending",
      "running",
      "completed",
      "failed",
      "skipped"
    ],
    "steps": [
      {
        "id": "mesh",
        "command": "blockMesh",
        "args": [],
        "cwd": ".",
        "depends_on": [],
        "produces": [],
        "consumes": [],
        "retry_policy": {},
        "command_display": "blockMesh"
      },
      {
        "id": "solve",
        "command": "cardiacFoam",
        "args": [],
        "cwd": ".",
        "depends_on": [
          "mesh"
        ],
        "produces": [
          "monodomain_vm_series",
          "monodomain_u1_series",
          "monodomain_u2_series",
          "monodomain_u3_series",
          "ecg_pseudo_ecg",
          "verification_error_summary"
        ],
        "consumes": [],
        "retry_policy": {},
        "command_display": "cardiacFoam"
      }
    ]
  },
  "workflowState": {
    "status": "pending",
    "current_step_id": "mesh",
    "completed_steps": [],
    "failed_step_id": null,
    "steps": [
      {
        "step_id": "mesh",
        "status": "pending",
        "attempt": 0,
        "command": "blockMesh",
        "args": [],
        "cwd": ".",
        "started_at": null,
        "finished_at": null,
        "exit_code": null,
        "stdout_log": null,
        "stderr_log": null,
        "produced_artifacts": [],
        "diagnostics": []
      },
      {
        "step_id": "solve",
        "status": "pending",
        "attempt": 0,
        "command": "cardiacFoam",
        "args": [],
        "cwd": ".",
        "started_at": null,
        "finished_at": null,
        "exit_code": null,
        "stdout_log": null,
        "stderr_log": null,
        "produced_artifacts": [],
        "diagnostics": []
      }
    ]
  },
  "launch": {
    "action": "sim",
    "command": [
      "/opt/homebrew/opt/python@3.14/bin/python3.14",
      "-m",
      "openfoam_driver",
      "sim",
      "--entry",
      "manufacturedFDA"
    ],
    "commandDisplay": "/opt/homebrew/opt/python@3.14/bin/python3.14 -m openfoam_driver sim --entry manufacturedFDA",
    "manifestPath": "/Users/simaocastro/noFrontendCardiacFoam_minor_errors/tutorials/manufacturedSolutions/monodomainPseudoECG/postProcessing/run_manifest.json",
    "caseRoot": "/Users/simaocastro/noFrontendCardiacFoam_minor_errors/tutorials/manufacturedSolutions/monodomainPseudoECG",
    "setupRoot": "/Users/simaocastro/noFrontendCardiacFoam_minor_errors/tutorials/manufacturedSolutions/monodomainPseudoECG/setup",
    "outputDir": "/Users/simaocastro/noFrontendCardiacFoam_minor_errors/tutorials/manufacturedSolutions/monodomainPseudoECG/postProcessing"
  },
  "expectedArtifacts": [
    {
      "artifact_id": "monodomain_vm_series",
      "path_pattern": "{time}/Vm",
      "format": "openfoam_time_dirs",
      "variables": [
        "Vm"
      ],
      "description": "Membrane voltage Vm (monodomainSolver, ionicModel=monodomainFDAManufactured)",
      "produced_by": "monodomainSolver",
      "optional": false,
      "time_indexed": true
    },
    {
      "artifact_id": "monodomain_u1_series",
      "path_pattern": "{time}/u1",
      "format": "openfoam_time_dirs",
      "variables": [
        "u1"
      ],
      "description": "Ionic export u1 (monodomainSolver)",
      "produced_by": "monodomainSolver",
      "optional": false,
      "time_indexed": true
    },
    {
      "artifact_id": "monodomain_u2_series",
      "path_pattern": "{time}/u2",
      "format": "openfoam_time_dirs",
      "variables": [
        "u2"
      ],
      "description": "Ionic export u2 (monodomainSolver)",
      "produced_by": "monodomainSolver",
      "optional": false,
      "time_indexed": true
    },
    {
      "artifact_id": "monodomain_u3_series",
      "path_pattern": "{time}/u3",
      "format": "openfoam_time_dirs",
      "variables": [
        "u3"
      ],
      "description": "Ionic export u3 (monodomainSolver)",
      "produced_by": "monodomainSolver",
      "optional": false,
      "time_indexed": true
    },
    {
      "artifact_id": "ecg_pseudo_ecg",
      "path_pattern": "postProcessing/pseudoECG.dat",
      "format": "csv_probe",
      "variables": [],
      "description": "Pseudo-ECG time series at the declared electrodes",
      "produced_by": "pseudoECG",
      "optional": false,
      "time_indexed": false
    },
    {
      "artifact_id": "verification_error_summary",
      "path_pattern": "postProcessing/*_*_cells_*.dat",
      "format": "csv_probe",
      "variables": [],
      "description": "Manufactured-solution L1/L2/Linf error norms emitted by manufacturedFDAMonodomainVerifier",
      "produced_by": "manufacturedFDAMonodomainVerifier",
      "optional": false,
      "time_indexed": false
    }
  ],
  "validation": {
    "status": "ok",
    "diagnostics": []
  },
  "results": null,
  "terminalStatusValues": [
    "completed",
    "failed"
  ]
}