{
  "id": "plan-niederer2012",
  "name": "niederer2012",
  "status": "planned",
  "config": {
    "anatomy": {},
    "physics": {
      "type": "electroModel",
      "myocardiumSolver": "monodomainSolver",
      "ionicModel": "BuenoOrovio",
      "tissue": "epicardialCells",
      "conductivity": "[-1 -3 3 0 0 2 0] (0.1334177215 0 0 0.01760617761 0 0.01760617761)",
      "chi": "[0 -1 0 0 0 0 0] 140000",
      "cm": "[-1 -4 4 0 0 2 0] 0.01"
    },
    "stimulus": {
      "externalStimulus.stimulusLocationMin": "(0 0 5.5e-3)",
      "externalStimulus.stimulusLocationMax": "(1.5e-3 1.5e-3 7e-3)",
      "externalStimulus.stimulusStartTime": "0.0",
      "externalStimulus.stimulusDuration": "[0 0 1 0 0 0 0] 2e-3",
      "externalStimulus.stimulusIntensity": "[0 -3 0 0 0 1 0] 50000",
      "stimulusLocationMin": "(0 0 5.5e-3)",
      "stimulusLocationMax": "(1.5e-3 1.5e-3 7e-3)"
    },
    "solver": {
      "solutionAlgorithm": "explicit",
      "activationThreshold": "0.0",
      "outputVariables.ionic.export": "(Vm Jsi)",
      "outputVariables.ionic.debug": "(Vm Iion)",
      "solver": "RKF45",
      "initialODEStep": "1e-6",
      "maxSteps": "1000000000"
    }
  },
  "version": "2",
  "createdAt": "",
  "lastModified": "",
  "intent": {
    "source": "strict_plan"
  },
  "resolvedEntry": {
    "entry": "niederer2012",
    "entryKind": "registered_tutorial",
    "entryPath": "NiedererEtAl2011/NiedererEtAl2011verification",
    "resolvedName": "niederer2012",
    "sourceType": "spec_factory",
    "workflowFamily": null,
    "isRunnable": true
  },
  "workflowDag": {
    "schema_version": "1",
    "step_status_values": [
      "pending",
      "running",
      "completed",
      "failed",
      "skipped"
    ],
    "steps": [
      {
        "id": "mesh",
        "command": "blockMesh",
        "args": [],
        "cwd": ".",
        "depends_on": [],
        "produces": [],
        "consumes": [],
        "retry_policy": {},
        "command_display": "blockMesh"
      },
      {
        "id": "solve",
        "command": "cardiacFoam",
        "args": [],
        "cwd": ".",
        "depends_on": [
          "mesh"
        ],
        "produces": [
          "monodomain_vm_series",
          "monodomain_jsi_series"
        ],
        "consumes": [],
        "retry_policy": {},
        "command_display": "cardiacFoam"
      },
      {
        "id": "samplePoints",
        "command": "postProcess",
        "args": [
          "-func",
          "Niedererpoints",
          "-latestTime"
        ],
        "cwd": ".",
        "depends_on": [
          "solve"
        ],
        "produces": [],
        "consumes": [],
        "retry_policy": {},
        "command_display": "postProcess -func Niedererpoints -latestTime"
      },
      {
        "id": "sampleLines",
        "command": "postProcess",
        "args": [
          "-func",
          "Niedererlines",
          "-latestTime"
        ],
        "cwd": ".",
        "depends_on": [
          "solve"
        ],
        "produces": [],
        "consumes": [],
        "retry_policy": {},
        "command_display": "postProcess -func Niedererlines -latestTime"
      }
    ]
  },
  "workflowState": {
    "status": "pending",
    "current_step_id": "mesh",
    "completed_steps": [],
    "failed_step_id": null,
    "steps": [
      {
        "step_id": "mesh",
        "status": "pending",
        "attempt": 0,
        "command": "blockMesh",
        "args": [],
        "cwd": ".",
        "started_at": null,
        "finished_at": null,
        "exit_code": null,
        "stdout_log": null,
        "stderr_log": null,
        "produced_artifacts": [],
        "diagnostics": []
      },
      {
        "step_id": "solve",
        "status": "pending",
        "attempt": 0,
        "command": "cardiacFoam",
        "args": [],
        "cwd": ".",
        "started_at": null,
        "finished_at": null,
        "exit_code": null,
        "stdout_log": null,
        "stderr_log": null,
        "produced_artifacts": [],
        "diagnostics": []
      },
      {
        "step_id": "samplePoints",
        "status": "pending",
        "attempt": 0,
        "command": "postProcess",
        "args": [
          "-func",
          "Niedererpoints",
          "-latestTime"
        ],
        "cwd": ".",
        "started_at": null,
        "finished_at": null,
        "exit_code": null,
        "stdout_log": null,
        "stderr_log": null,
        "produced_artifacts": [],
        "diagnostics": []
      },
      {
        "step_id": "sampleLines",
        "status": "pending",
        "attempt": 0,
        "command": "postProcess",
        "args": [
          "-func",
          "Niedererlines",
          "-latestTime"
        ],
        "cwd": ".",
        "started_at": null,
        "finished_at": null,
        "exit_code": null,
        "stdout_log": null,
        "stderr_log": null,
        "produced_artifacts": [],
        "diagnostics": []
      }
    ]
  },
  "launch": {
    "action": "sim",
    "command": [
      "/opt/homebrew/opt/python@3.14/bin/python3.14",
      "-m",
      "openfoam_driver",
      "sim",
      "--entry",
      "niederer2012"
    ],
    "commandDisplay": "/opt/homebrew/opt/python@3.14/bin/python3.14 -m openfoam_driver sim --entry niederer2012",
    "manifestPath": "/Users/simaocastro/noFrontendCardiacFoam_minor_errors/tutorials/NiedererEtAl2011/NiedererEtAl2011verification/postProcessing/run_manifest.json",
    "caseRoot": "/Users/simaocastro/noFrontendCardiacFoam_minor_errors/tutorials/NiedererEtAl2011/NiedererEtAl2011verification",
    "setupRoot": "/Users/simaocastro/noFrontendCardiacFoam_minor_errors/tutorials/NiedererEtAl2011/NiedererEtAl2011verification/setup",
    "outputDir": "/Users/simaocastro/noFrontendCardiacFoam_minor_errors/tutorials/NiedererEtAl2011/NiedererEtAl2011verification/postProcessing"
  },
  "expectedArtifacts": [
    {
      "artifact_id": "monodomain_vm_series",
      "path_pattern": "{time}/Vm",
      "format": "openfoam_time_dirs",
      "variables": [
        "Vm"
      ],
      "description": "Ionic export Vm (monodomainSolver)",
      "produced_by": "monodomainSolver",
      "optional": false,
      "time_indexed": true
    },
    {
      "artifact_id": "monodomain_jsi_series",
      "path_pattern": "{time}/Jsi",
      "format": "openfoam_time_dirs",
      "variables": [
        "Jsi"
      ],
      "description": "Ionic export Jsi (monodomainSolver)",
      "produced_by": "monodomainSolver",
      "optional": false,
      "time_indexed": true
    }
  ],
  "validation": {
    "status": "ok",
    "diagnostics": []
  },
  "results": null,
  "terminalStatusValues": [
    "completed",
    "failed"
  ]
}